{
  "$schema": "http://json-schema.org/draft-07/schema#",
  "type": "array",
  "items": {
    "type": "object",
    "required": ["stableId", "version", "jurisdiction", "title", "bodyText"],
    "properties": {
      "stableId": { "type": "string", "minLength": 1 },
      "version": { "type": "integer", "minimum": 1 },
      "jurisdiction": { "type": "string", "minLength": 1 },
      "title": { "type": "string", "minLength": 1 },
      "bodyText": { "type": "string" },
      "publish": { "type": "boolean" },
      "deprecate": { "type": "boolean" },
      "deprecateReason": { "type": "string" },
      "metadata": { "type": "object" }
    },
    "additionalProperties": true
  }
}
